{
  "sealVersion": "huqan-bundle-seal-v2",
  "schemaVersion": "v4-receipt-bundle-v1",
  "workspaceId": "default",
  "exportedAt": "2026-01-01T00:00:00.000Z",
  "receiptCount": 3,
  "bundleHash": "26244bb0512992b0078504864d698a9c5876fd5a5e12ffc7439b68b55fcc7d00",
  "receipts": [
    {
      "schemaVersion": "v4-receipt-v1",
      "receiptId": "madm_receipt_3796911f1745af762fe87ae4bf4e68a5",
      "receiptKind": "memory_admission_receipt",
      "decision": "allow",
      "verdict": "allow",
      "status": "admitted",
      "admissionId": "madm_2438109b6dca34858f62c8a736a09d2b",
      "workspaceId": "default",
      "actor": "c5a-generator",
      "agentId": "kernel",
      "memoryDraftId": "draft_prov-c5a-0",
      "provenanceId": "prov-c5a-0",
      "trustPolicyVersion": "0.8.0",
      "approvalId": "apr-c5a-0",
      "approvalStatus": "approved",
      "reason": "provenance_present_low_risk",
      "riskScore": 0,
      "createdAt": "2026-01-01T00:00:00.000Z",
      "metadata": {},
      "previousReceiptHash": "genesis:v4-receipt-chain",
      "receiptHash": "3c8bfe7d26e9ede5ca31d0e1398b7284ab8876e00cc67dbec67608b791922ac6"
    },
    {
      "schemaVersion": "v4-receipt-v1",
      "receiptId": "madm_receipt_083828511b77ee20c5246b6a4b6f3145",
      "receiptKind": "memory_admission_receipt",
      "decision": "allow",
      "verdict": "allow",
      "status": "admitted",
      "admissionId": "madm_a3a983c95ca2feb84f29bd2fc2d34302",
      "workspaceId": "default",
      "actor": "c5a-generator",
      "agentId": "kernel",
      "memoryDraftId": "draft_prov-c5a-1",
      "provenanceId": "prov-c5a-1",
      "trustPolicyVersion": "0.8.0",
      "approvalId": "apr-c5a-1",
      "approvalStatus": "approved",
      "reason": "provenance_present_low_risk",
      "riskScore": 0,
      "createdAt": "2026-01-02T00:00:00.000Z",
      "metadata": {},
      "previousReceiptHash": "3c8bfe7d26e9ede5ca31d0e1398b7284ab8876e00cc67dbec67608b791922ac6",
      "receiptHash": "c9a316f9dc6316ad82fe82c62eec86000d1129bdda960553bf78e758a7d7e869"
    },
    {
      "schemaVersion": "v4-receipt-v1",
      "receiptId": "madm_receipt_8cc2b5331f75a4d8db11aba93d815d7a",
      "receiptKind": "memory_admission_receipt",
      "decision": "allow",
      "verdict": "allow",
      "status": "admitted",
      "admissionId": "madm_a67b1e67ea461f3830a729129673a724",
      "workspaceId": "default",
      "actor": "c5a-generator",
      "agentId": "kernel",
      "memoryDraftId": "draft_prov-c5a-2",
      "provenanceId": "prov-c5a-2",
      "trustPolicyVersion": "0.8.0",
      "approvalId": "apr-c5a-2",
      "approvalStatus": "approved",
      "reason": "provenance_present_low_risk",
      "riskScore": 0,
      "createdAt": "2026-01-03T00:00:00.000Z",
      "metadata": {},
      "previousReceiptHash": "c9a316f9dc6316ad82fe82c62eec86000d1129bdda960553bf78e758a7d7e869",
      "receiptHash": "2d672b6ee7666d748ed8c9b716a0cea7895079c436e52fc27a57d92c7aa58241"
    }
  ]
}
